{
  "schema_version": "1.3.0",
  "audit_id": "b6a0c7ba-ef61-4cd9-a383-4cf055b2071d",
  "url": "https://maganeguma.lk",
  "normalized_url": "https://maganeguma.lk/",
  "started_at": "2026-10-14T06:49:08.322770+05:30",
  "completed_at": "2026-10-14T06:49:19.063506+05:30",
  "result": {
    "status": "inconclusive",
    "confidence": 0.5,
    "reasons": [
      "http_available: An HTTP probe was transient",
      "tls_not_expired: [Errno 111] Connection refused",
      "tls_hostname_matches: [Errno 111] Connection refused"
    ]
  },
  "evidence": [
    {
      "check": "dns",
      "status": "pass",
      "detail": "Public DNS resolved",
      "observed_at": "2026-10-14T06:49:10.983185+05:30"
    },
    {
      "check": "domain_registration",
      "status": "error",
      "detail": "Domain is absent from RDAP",
      "observed_at": "2026-10-14T06:49:10.983203+05:30"
    },
    {
      "check": "tls",
      "status": "error",
      "detail": "[Errno 111] Connection refused",
      "observed_at": "2026-10-14T06:49:11.929303+05:30"
    },
    {
      "check": "http",
      "status": "error",
      "detail": "Probe 1: [Errno 111] Connection refused",
      "source": "https://maganeguma.lk/",
      "observed_at": "2026-10-14T06:49:19.055526+05:30"
    },
    {
      "check": "http",
      "status": "pass",
      "detail": "Probe 2: HTTP 200 at http://maganeguma.lk/",
      "source": "http://maganeguma.lk/",
      "observed_at": "2026-10-14T06:49:19.055546+05:30"
    },
    {
      "check": "http",
      "status": "error",
      "detail": "Probe 3: [Errno 111] Connection refused",
      "source": "https://maganeguma.lk/",
      "observed_at": "2026-10-14T06:49:19.055550+05:30"
    },
    {
      "check": "http",
      "status": "pass",
      "detail": "Probe 4: HTTP 200 at http://maganeguma.lk/",
      "source": "http://maganeguma.lk/",
      "observed_at": "2026-10-14T06:49:19.055552+05:30"
    },
    {
      "check": "phone",
      "status": "pass",
      "detail": "Published phone: +94 (0)11 421-606",
      "source": "http://maganeguma.lk/",
      "data": {
        "value": "+94 (0)11 421-606"
      }
    },
    {
      "check": "phone",
      "status": "pass",
      "detail": "Published phone: 0114216061",
      "source": "http://maganeguma.lk/",
      "data": {
        "value": "0114216061"
      }
    },
    {
      "check": "email",
      "status": "pass",
      "detail": "Published email: hostmaster@domains.lk",
      "source": "http://maganeguma.lk/",
      "data": {
        "value": "hostmaster@domains.lk"
      }
    },
    {
      "check": "named_responsibility",
      "status": "pass",
      "detail": "Published named responsibility: division",
      "source": "http://maganeguma.lk/",
      "data": {
        "value": "division"
      }
    },
    {
      "check": "phone",
      "status": "pass",
      "detail": "Published phone: +94 (0)11 421-606",
      "source": "http://maganeguma.lk/",
      "data": {
        "value": "+94 (0)11 421-606"
      }
    },
    {
      "check": "phone",
      "status": "pass",
      "detail": "Published phone: 0114216061",
      "source": "http://maganeguma.lk/",
      "data": {
        "value": "0114216061"
      }
    },
    {
      "check": "email",
      "status": "pass",
      "detail": "Published email: hostmaster@domains.lk",
      "source": "http://maganeguma.lk/",
      "data": {
        "value": "hostmaster@domains.lk"
      }
    },
    {
      "check": "named_responsibility",
      "status": "pass",
      "detail": "Published named responsibility: division",
      "source": "http://maganeguma.lk/",
      "data": {
        "value": "division"
      }
    },
    {
      "check": "page_text",
      "status": "pass",
      "detail": "Substantive page content: 1468 visible characters across 2 pages",
      "source": "https://maganeguma.lk/"
    }
  ],
  "observations": [
    {
      "host": "maganeguma.lk",
      "addresses": [
        "64.120.94.96"
      ],
      "status": "resolved",
      "detail": "Public DNS resolved"
    },
    {
      "domain": "maganeguma.lk",
      "status": "unknown",
      "expires_at": null,
      "detail": "Domain is absent from RDAP"
    },
    {
      "host": "maganeguma.lk",
      "status": "error",
      "expires_at": null,
      "hostname_valid": null,
      "detail": "[Errno 111] Connection refused"
    },
    {
      "url": "https://maganeguma.lk/",
      "status_code": null,
      "final_url": null,
      "redirects": [],
      "elapsed_ms": null,
      "content_type": null,
      "error": "[Errno 111] Connection refused"
    },
    {
      "url": "http://maganeguma.lk/",
      "status_code": 200,
      "final_url": "http://maganeguma.lk/",
      "redirects": [],
      "elapsed_ms": 2710,
      "content_type": "text/html",
      "error": null
    },
    {
      "url": "https://maganeguma.lk/",
      "status_code": null,
      "final_url": null,
      "redirects": [],
      "elapsed_ms": null,
      "content_type": null,
      "error": "[Errno 111] Connection refused"
    },
    {
      "url": "http://maganeguma.lk/",
      "status_code": 200,
      "final_url": "http://maganeguma.lk/",
      "redirects": [],
      "elapsed_ms": 728,
      "content_type": "text/html",
      "error": null
    }
  ],
  "snapshots": [
    {
      "url": "http://maganeguma.lk/",
      "path": "audit.output/maganeguma.lk/20261014.0649/snapshots/page-01-3c5eb1957783.html",
      "sha256": "3c5eb195778329b8ca01476e44349207a103fc1a43df81ca00e0d29ac0ca35d4",
      "bytes": 17156
    },
    {
      "url": "http://maganeguma.lk/",
      "path": "audit.output/maganeguma.lk/20261014.0649/snapshots/page-02-3c5eb1957783.html",
      "sha256": "3c5eb195778329b8ca01476e44349207a103fc1a43df81ca00e0d29ac0ca35d4",
      "bytes": 17156
    }
  ],
  "reviewer_decisions": [],
  "levels": [
    {
      "level": 0,
      "description": "A site is classified as `Level 0` when it is unavailable or unusable, or when there is not enough evidence to establish that it meets `Level 1`.",
      "status": "pass",
      "reason": "Baseline website grade",
      "executed": true,
      "checks": []
    },
    {
      "level": 1,
      "description": "To pass `Level 1`, the website must be available, usable, and clearly associated with the government institution. It must load reliably with valid DNS, HTTP, and TLS behavior.",
      "status": "inconclusive",
      "reason": "An HTTP probe was transient; [Errno 111] Connection refused; [Errno 111] Connection refused",
      "executed": true,
      "checks": [
        {
          "name": "dns_resolves",
          "level": 1,
          "status": "pass",
          "reason": "Public DNS resolved"
        },
        {
          "name": "domain_not_parked",
          "level": 1,
          "status": "pass",
          "reason": "No parked-domain marker found"
        },
        {
          "name": "site_not_defaced",
          "level": 1,
          "status": "pass",
          "reason": "No defacement marker found"
        },
        {
          "name": "content_relevant",
          "level": 1,
          "status": "pass",
          "reason": "No unrelated-content marker found"
        },
        {
          "name": "hosting_configured",
          "level": 1,
          "status": "pass",
          "reason": "No generic-hosting marker found"
        },
        {
          "name": "http_available",
          "level": 1,
          "status": "inconclusive",
          "reason": "An HTTP probe was transient"
        },
        {
          "name": "redirect_related",
          "level": 1,
          "status": "pass",
          "reason": "No unrelated redirect found"
        },
        {
          "name": "tls_browser_trusted",
          "level": 1,
          "status": "pass",
          "reason": "No browser-blocking TLS error found"
        },
        {
          "name": "tls_not_expired",
          "level": 1,
          "status": "inconclusive",
          "reason": "[Errno 111] Connection refused"
        },
        {
          "name": "tls_hostname_matches",
          "level": 1,
          "status": "inconclusive",
          "reason": "[Errno 111] Connection refused"
        }
      ]
    },
    {
      "level": 2,
      "description": "To pass `Level 2`, citizens must be able to identify and contact the correct office for the service they need.",
      "status": "inconclusive",
      "reason": "Not run because Level 1 did not pass",
      "executed": false,
      "checks": []
    },
    {
      "level": 3,
      "description": "To pass `Level 3`, citizens must find complete and current instructions, requirements, fees, times, and usable forms.",
      "status": "inconclusive",
      "reason": "Not run because Level 2 did not pass",
      "executed": false,
      "checks": []
    },
    {
      "level": 4,
      "description": "To pass `Level 4`, citizens must be able to complete, pay for, track, and receive the outcome of a service online.",
      "status": "inconclusive",
      "reason": "Not run because Level 3 did not pass",
      "executed": false,
      "checks": []
    },
    {
      "level": 5,
      "description": "To pass `Level 5`, services must be connected across agencies, proactive for eligible citizens, explainable, and accountable.",
      "status": "inconclusive",
      "reason": "Not run because Level 4 did not pass",
      "executed": false,
      "checks": []
    }
  ],
  "vantage": {
    "egress_ip": "52.161.56.68",
    "country": "US",
    "runner": "github-actions",
    "proxy": false
  }
}
