{
  "schema_version": "1.3.0",
  "audit_id": "b14538b6-ef97-444e-be95-8e2560423b52",
  "url": "https://airport.lk",
  "normalized_url": "https://airport.lk/",
  "started_at": "2026-10-31T06:33:11.978935+05:30",
  "completed_at": "2026-10-31T06:33:17.341402+05:30",
  "result": {
    "status": "fail",
    "confidence": 1.0,
    "reasons": [
      "tls_browser_trusted: Probe 3: [SSL: CERTIFICATE_VERIFY_FAILED] certificate verify failed: unable to get local issuer certificate (_ssl.c:1011)"
    ]
  },
  "evidence": [
    {
      "check": "dns",
      "status": "pass",
      "detail": "Public DNS resolved",
      "observed_at": "2026-10-31T06:33:12.909292+05:30"
    },
    {
      "check": "domain_registration",
      "status": "error",
      "detail": "Domain is absent from RDAP",
      "observed_at": "2026-10-31T06:33:12.909310+05:30"
    },
    {
      "check": "tls",
      "status": "error",
      "detail": "[Errno 104] Connection reset by peer",
      "observed_at": "2026-10-31T06:33:13.437530+05:30"
    },
    {
      "check": "http",
      "status": "error",
      "detail": "Probe 1: [Errno 104] Connection reset by peer",
      "source": "https://airport.lk/",
      "observed_at": "2026-10-31T06:33:17.341245+05:30"
    },
    {
      "check": "http",
      "status": "error",
      "detail": "Probe 2: [Errno 104] Connection reset by peer",
      "source": "http://airport.lk/",
      "observed_at": "2026-10-31T06:33:17.341264+05:30"
    },
    {
      "check": "tls_browser_error",
      "status": "fail",
      "detail": "Probe 3: [SSL: CERTIFICATE_VERIFY_FAILED] certificate verify failed: unable to get local issuer certificate (_ssl.c:1011)",
      "source": "https://airport.lk/",
      "observed_at": "2026-10-31T06:33:17.341268+05:30"
    },
    {
      "check": "http",
      "status": "error",
      "detail": "Probe 4: [Errno 104] Connection reset by peer",
      "source": "http://airport.lk/",
      "observed_at": "2026-10-31T06:33:17.341272+05:30"
    }
  ],
  "observations": [
    {
      "host": "airport.lk",
      "addresses": [
        "203.115.19.243"
      ],
      "status": "resolved",
      "detail": "Public DNS resolved"
    },
    {
      "domain": "airport.lk",
      "status": "unknown",
      "expires_at": null,
      "detail": "Domain is absent from RDAP"
    },
    {
      "host": "airport.lk",
      "status": "error",
      "expires_at": null,
      "hostname_valid": null,
      "detail": "[Errno 104] Connection reset by peer"
    },
    {
      "url": "https://airport.lk/",
      "status_code": null,
      "final_url": null,
      "redirects": [],
      "elapsed_ms": null,
      "content_type": null,
      "error": "[Errno 104] Connection reset by peer"
    },
    {
      "url": "http://airport.lk/",
      "status_code": null,
      "final_url": null,
      "redirects": [],
      "elapsed_ms": null,
      "content_type": null,
      "error": "[Errno 104] Connection reset by peer"
    },
    {
      "url": "https://airport.lk/",
      "status_code": null,
      "final_url": null,
      "redirects": [],
      "elapsed_ms": null,
      "content_type": null,
      "error": "[SSL: CERTIFICATE_VERIFY_FAILED] certificate verify failed: unable to get local issuer certificate (_ssl.c:1011)"
    },
    {
      "url": "http://airport.lk/",
      "status_code": null,
      "final_url": null,
      "redirects": [],
      "elapsed_ms": null,
      "content_type": null,
      "error": "[Errno 104] Connection reset by peer"
    }
  ],
  "snapshots": [],
  "reviewer_decisions": [],
  "levels": [
    {
      "level": 0,
      "description": "A site is classified as `Level 0` when it is unavailable or unusable, or when there is not enough evidence to establish that it meets `Level 1`.",
      "status": "pass",
      "reason": "Baseline website grade",
      "executed": true,
      "checks": []
    },
    {
      "level": 1,
      "description": "To pass `Level 1`, the website must be available, usable, and clearly associated with the government institution. It must load reliably with valid DNS, HTTP, and TLS behavior.",
      "status": "fail",
      "reason": "Probe 3: [SSL: CERTIFICATE_VERIFY_FAILED] certificate verify failed: unable to get local issuer certificate (_ssl.c:1011)",
      "executed": true,
      "checks": [
        {
          "name": "dns_resolves",
          "level": 1,
          "status": "pass",
          "reason": "Public DNS resolved"
        },
        {
          "name": "domain_not_parked",
          "level": 1,
          "status": "inconclusive",
          "reason": "No usable page was inspected"
        },
        {
          "name": "site_not_defaced",
          "level": 1,
          "status": "inconclusive",
          "reason": "No usable page was inspected"
        },
        {
          "name": "content_relevant",
          "level": 1,
          "status": "inconclusive",
          "reason": "No usable page was inspected"
        },
        {
          "name": "hosting_configured",
          "level": 1,
          "status": "inconclusive",
          "reason": "No usable page was inspected"
        },
        {
          "name": "http_available",
          "level": 1,
          "status": "inconclusive",
          "reason": "An HTTP probe was transient"
        },
        {
          "name": "redirect_related",
          "level": 1,
          "status": "inconclusive",
          "reason": "No redirect result was available"
        },
        {
          "name": "tls_browser_trusted",
          "level": 1,
          "status": "fail",
          "reason": "Probe 3: [SSL: CERTIFICATE_VERIFY_FAILED] certificate verify failed: unable to get local issuer certificate (_ssl.c:1011)"
        },
        {
          "name": "tls_not_expired",
          "level": 1,
          "status": "inconclusive",
          "reason": "[Errno 104] Connection reset by peer"
        },
        {
          "name": "tls_hostname_matches",
          "level": 1,
          "status": "inconclusive",
          "reason": "[Errno 104] Connection reset by peer"
        }
      ]
    },
    {
      "level": 2,
      "description": "To pass `Level 2`, citizens must be able to identify and contact the correct office for the service they need.",
      "status": "inconclusive",
      "reason": "Not run because Level 1 did not pass",
      "executed": false,
      "checks": []
    },
    {
      "level": 3,
      "description": "To pass `Level 3`, citizens must find complete and current instructions, requirements, fees, times, and usable forms.",
      "status": "inconclusive",
      "reason": "Not run because Level 2 did not pass",
      "executed": false,
      "checks": []
    },
    {
      "level": 4,
      "description": "To pass `Level 4`, citizens must be able to complete, pay for, track, and receive the outcome of a service online.",
      "status": "inconclusive",
      "reason": "Not run because Level 3 did not pass",
      "executed": false,
      "checks": []
    },
    {
      "level": 5,
      "description": "To pass `Level 5`, services must be connected across agencies, proactive for eligible citizens, explainable, and accountable.",
      "status": "inconclusive",
      "reason": "Not run because Level 4 did not pass",
      "executed": false,
      "checks": []
    }
  ],
  "vantage": {
    "egress_ip": "158.23.19.35",
    "country": "MX",
    "runner": "github-actions",
    "proxy": false
  }
}
