{
  "schema_version": "1.3.0",
  "audit_id": "7ff232d7-6d22-4628-9e6e-778c2606a8e1",
  "url": "https://npd.treasury.gov.lk/",
  "normalized_url": "https://npd.treasury.gov.lk/",
  "started_at": "2026-10-24T06:24:21.079707+05:30",
  "completed_at": "2026-10-24T06:25:25.271020+05:30",
  "result": {
    "status": "inconclusive",
    "confidence": 0.5,
    "reasons": [
      "domain_not_parked: No usable page was inspected",
      "site_not_defaced: No usable page was inspected",
      "content_relevant: No usable page was inspected",
      "hosting_configured: No usable page was inspected",
      "http_available: An HTTP probe was transient",
      "redirect_related: No redirect result was available",
      "tls_browser_trusted: Browser TLS check did not complete",
      "tls_not_expired: [SSL: UNSAFE_LEGACY_RENEGOTIATION_DISABLED] unsafe legacy renegotiation disabled (_ssl.c:1010)",
      "tls_hostname_matches: [SSL: UNSAFE_LEGACY_RENEGOTIATION_DISABLED] unsafe legacy renegotiation disabled (_ssl.c:1010)"
    ]
  },
  "evidence": [
    {
      "check": "dns",
      "status": "pass",
      "detail": "Public DNS resolved",
      "observed_at": "2026-10-24T06:24:21.411267+05:30"
    },
    {
      "check": "domain_registration",
      "status": "error",
      "detail": "Domain is absent from RDAP",
      "observed_at": "2026-10-24T06:24:21.411283+05:30"
    },
    {
      "check": "tls",
      "status": "error",
      "detail": "[SSL: UNSAFE_LEGACY_RENEGOTIATION_DISABLED] unsafe legacy renegotiation disabled (_ssl.c:1010)",
      "observed_at": "2026-10-24T06:24:21.913253+05:30"
    },
    {
      "check": "http",
      "status": "error",
      "detail": "Probe 1: [SSL: UNSAFE_LEGACY_RENEGOTIATION_DISABLED] unsafe legacy renegotiation disabled (_ssl.c:1010)",
      "source": "https://npd.treasury.gov.lk/",
      "observed_at": "2026-10-24T06:25:25.270822+05:30"
    },
    {
      "check": "http",
      "status": "error",
      "detail": "Probe 2: timed out",
      "source": "http://npd.treasury.gov.lk/",
      "observed_at": "2026-10-24T06:25:25.270844+05:30"
    },
    {
      "check": "http",
      "status": "error",
      "detail": "Probe 3: [SSL: UNSAFE_LEGACY_RENEGOTIATION_DISABLED] unsafe legacy renegotiation disabled (_ssl.c:1010)",
      "source": "https://npd.treasury.gov.lk/",
      "observed_at": "2026-10-24T06:25:25.270850+05:30"
    },
    {
      "check": "http",
      "status": "error",
      "detail": "Probe 4: timed out",
      "source": "http://npd.treasury.gov.lk/",
      "observed_at": "2026-10-24T06:25:25.270855+05:30"
    }
  ],
  "observations": [
    {
      "host": "npd.treasury.gov.lk",
      "addresses": [
        "203.94.72.138"
      ],
      "status": "resolved",
      "detail": "Public DNS resolved"
    },
    {
      "domain": "treasury.gov.lk",
      "status": "unknown",
      "expires_at": null,
      "detail": "Domain is absent from RDAP"
    },
    {
      "host": "npd.treasury.gov.lk",
      "status": "error",
      "expires_at": null,
      "hostname_valid": null,
      "detail": "[SSL: UNSAFE_LEGACY_RENEGOTIATION_DISABLED] unsafe legacy renegotiation disabled (_ssl.c:1010)"
    },
    {
      "url": "https://npd.treasury.gov.lk/",
      "status_code": null,
      "final_url": null,
      "redirects": [],
      "elapsed_ms": null,
      "content_type": null,
      "error": "[SSL: UNSAFE_LEGACY_RENEGOTIATION_DISABLED] unsafe legacy renegotiation disabled (_ssl.c:1010)"
    },
    {
      "url": "http://npd.treasury.gov.lk/",
      "status_code": null,
      "final_url": null,
      "redirects": [],
      "elapsed_ms": null,
      "content_type": null,
      "error": "timed out"
    },
    {
      "url": "https://npd.treasury.gov.lk/",
      "status_code": null,
      "final_url": null,
      "redirects": [],
      "elapsed_ms": null,
      "content_type": null,
      "error": "[SSL: UNSAFE_LEGACY_RENEGOTIATION_DISABLED] unsafe legacy renegotiation disabled (_ssl.c:1010)"
    },
    {
      "url": "http://npd.treasury.gov.lk/",
      "status_code": null,
      "final_url": null,
      "redirects": [],
      "elapsed_ms": null,
      "content_type": null,
      "error": "timed out"
    }
  ],
  "snapshots": [],
  "reviewer_decisions": [],
  "levels": [
    {
      "level": 0,
      "description": "A site is classified as `Level 0` when it is unavailable or unusable, or when there is not enough evidence to establish that it meets `Level 1`.",
      "status": "pass",
      "reason": "Baseline website grade",
      "executed": true,
      "checks": []
    },
    {
      "level": 1,
      "description": "To pass `Level 1`, the website must be available, usable, and clearly associated with the government institution. It must load reliably with valid DNS, HTTP, and TLS behavior.",
      "status": "inconclusive",
      "reason": "No usable page was inspected; No usable page was inspected; No usable page was inspected; No usable page was inspected; An HTTP probe was transient; No redirect result was available; Browser TLS check did not complete; [SSL: UNSAFE_LEGACY_RENEGOTIATION_DISABLED] unsafe legacy renegotiation disabled (_ssl.c:1010); [SSL: UNSAFE_LEGACY_RENEGOTIATION_DISABLED] unsafe legacy renegotiation disabled (_ssl.c:1010)",
      "executed": true,
      "checks": [
        {
          "name": "dns_resolves",
          "level": 1,
          "status": "pass",
          "reason": "Public DNS resolved"
        },
        {
          "name": "domain_not_parked",
          "level": 1,
          "status": "inconclusive",
          "reason": "No usable page was inspected"
        },
        {
          "name": "site_not_defaced",
          "level": 1,
          "status": "inconclusive",
          "reason": "No usable page was inspected"
        },
        {
          "name": "content_relevant",
          "level": 1,
          "status": "inconclusive",
          "reason": "No usable page was inspected"
        },
        {
          "name": "hosting_configured",
          "level": 1,
          "status": "inconclusive",
          "reason": "No usable page was inspected"
        },
        {
          "name": "http_available",
          "level": 1,
          "status": "inconclusive",
          "reason": "An HTTP probe was transient"
        },
        {
          "name": "redirect_related",
          "level": 1,
          "status": "inconclusive",
          "reason": "No redirect result was available"
        },
        {
          "name": "tls_browser_trusted",
          "level": 1,
          "status": "inconclusive",
          "reason": "Browser TLS check did not complete"
        },
        {
          "name": "tls_not_expired",
          "level": 1,
          "status": "inconclusive",
          "reason": "[SSL: UNSAFE_LEGACY_RENEGOTIATION_DISABLED] unsafe legacy renegotiation disabled (_ssl.c:1010)"
        },
        {
          "name": "tls_hostname_matches",
          "level": 1,
          "status": "inconclusive",
          "reason": "[SSL: UNSAFE_LEGACY_RENEGOTIATION_DISABLED] unsafe legacy renegotiation disabled (_ssl.c:1010)"
        }
      ]
    },
    {
      "level": 2,
      "description": "To pass `Level 2`, citizens must be able to identify and contact the correct office for the service they need.",
      "status": "inconclusive",
      "reason": "Not run because Level 1 did not pass",
      "executed": false,
      "checks": []
    },
    {
      "level": 3,
      "description": "To pass `Level 3`, citizens must find complete and current instructions, requirements, fees, times, and usable forms.",
      "status": "inconclusive",
      "reason": "Not run because Level 2 did not pass",
      "executed": false,
      "checks": []
    },
    {
      "level": 4,
      "description": "To pass `Level 4`, citizens must be able to complete, pay for, track, and receive the outcome of a service online.",
      "status": "inconclusive",
      "reason": "Not run because Level 3 did not pass",
      "executed": false,
      "checks": []
    },
    {
      "level": 5,
      "description": "To pass `Level 5`, services must be connected across agencies, proactive for eligible citizens, explainable, and accountable.",
      "status": "inconclusive",
      "reason": "Not run because Level 4 did not pass",
      "executed": false,
      "checks": []
    }
  ],
  "vantage": {
    "egress_ip": "4.229.37.5",
    "country": "CA",
    "runner": "github-actions",
    "proxy": false
  }
}
