{
  "schema_version": "1.3.0",
  "audit_id": "9aeccc29-e122-44a3-ba46-cb063198dcaf",
  "url": "https://condominium.lk/",
  "normalized_url": "https://condominium.lk/",
  "started_at": "2026-10-03T06:48:42.860241+05:30",
  "completed_at": "2026-10-03T06:48:59.681568+05:30",
  "result": {
    "status": "inconclusive",
    "confidence": 0.5,
    "reasons": [
      "domain_not_parked: Insufficient substantive page content: Only 44 visible characters across 4 pages; below substance threshold 200",
      "site_not_defaced: Insufficient substantive page content: Only 44 visible characters across 4 pages; below substance threshold 200",
      "content_relevant: Insufficient substantive page content: Only 44 visible characters across 4 pages; below substance threshold 200",
      "hosting_configured: Insufficient substantive page content: Only 44 visible characters across 4 pages; below substance threshold 200"
    ]
  },
  "evidence": [
    {
      "check": "dns",
      "status": "pass",
      "detail": "Public DNS resolved",
      "observed_at": "2026-10-03T06:48:48.345746+05:30"
    },
    {
      "check": "domain_registration",
      "status": "error",
      "detail": "Domain is absent from RDAP",
      "observed_at": "2026-10-03T06:48:48.345767+05:30"
    },
    {
      "check": "tls",
      "status": "pass",
      "detail": "TLS certificate valid",
      "observed_at": "2026-10-03T06:48:48.804750+05:30"
    },
    {
      "check": "http",
      "status": "pass",
      "detail": "Probe 1: HTTP 200 at https://condominium.lk/",
      "source": "https://condominium.lk/",
      "observed_at": "2026-10-03T06:48:59.679447+05:30"
    },
    {
      "check": "http",
      "status": "pass",
      "detail": "Probe 2: HTTP 200 at http://condominium.lk/",
      "source": "http://condominium.lk/",
      "observed_at": "2026-10-03T06:48:59.679468+05:30"
    },
    {
      "check": "http",
      "status": "pass",
      "detail": "Probe 3: HTTP 200 at https://condominium.lk/",
      "source": "https://condominium.lk/",
      "observed_at": "2026-10-03T06:48:59.679472+05:30"
    },
    {
      "check": "http",
      "status": "pass",
      "detail": "Probe 4: HTTP 200 at http://condominium.lk/",
      "source": "http://condominium.lk/",
      "observed_at": "2026-10-03T06:48:59.679476+05:30"
    },
    {
      "check": "page_text",
      "status": "fail",
      "detail": "Only 44 visible characters across 4 pages; below substance threshold 200",
      "source": "https://condominium.lk/"
    }
  ],
  "observations": [
    {
      "host": "condominium.lk",
      "addresses": [
        "203.143.21.140"
      ],
      "status": "resolved",
      "detail": "Public DNS resolved"
    },
    {
      "domain": "condominium.lk",
      "status": "unknown",
      "expires_at": null,
      "detail": "Domain is absent from RDAP"
    },
    {
      "host": "condominium.lk",
      "status": "valid",
      "expires_at": "2026-11-30T07:50:15+05:30",
      "hostname_valid": true,
      "detail": "TLS certificate valid"
    },
    {
      "url": "https://condominium.lk/",
      "status_code": 200,
      "final_url": "https://condominium.lk/",
      "redirects": [],
      "elapsed_ms": 2998,
      "content_type": "text/html",
      "error": null
    },
    {
      "url": "http://condominium.lk/",
      "status_code": 200,
      "final_url": "http://condominium.lk/",
      "redirects": [],
      "elapsed_ms": 2881,
      "content_type": "text/html",
      "error": null
    },
    {
      "url": "https://condominium.lk/",
      "status_code": 200,
      "final_url": "https://condominium.lk/",
      "redirects": [],
      "elapsed_ms": 724,
      "content_type": "text/html",
      "error": null
    },
    {
      "url": "http://condominium.lk/",
      "status_code": 200,
      "final_url": "http://condominium.lk/",
      "redirects": [],
      "elapsed_ms": 478,
      "content_type": "text/html",
      "error": null
    }
  ],
  "snapshots": [
    {
      "url": "https://condominium.lk/",
      "path": "audit.output/condominium.lk/20261003.0648/snapshots/page-01-343f81bc4627.html",
      "sha256": "343f81bc462753dceb50be94e91f372ac0dafc0d2d22f2ea1e6c4f8457d7c293",
      "bytes": 1192
    },
    {
      "url": "http://condominium.lk/",
      "path": "audit.output/condominium.lk/20261003.0648/snapshots/page-02-343f81bc4627.html",
      "sha256": "343f81bc462753dceb50be94e91f372ac0dafc0d2d22f2ea1e6c4f8457d7c293",
      "bytes": 1192
    },
    {
      "url": "https://condominium.lk/",
      "path": "audit.output/condominium.lk/20261003.0648/snapshots/page-03-343f81bc4627.html",
      "sha256": "343f81bc462753dceb50be94e91f372ac0dafc0d2d22f2ea1e6c4f8457d7c293",
      "bytes": 1192
    },
    {
      "url": "http://condominium.lk/",
      "path": "audit.output/condominium.lk/20261003.0648/snapshots/page-04-343f81bc4627.html",
      "sha256": "343f81bc462753dceb50be94e91f372ac0dafc0d2d22f2ea1e6c4f8457d7c293",
      "bytes": 1192
    }
  ],
  "reviewer_decisions": [],
  "levels": [
    {
      "level": 0,
      "description": "A site is classified as `Level 0` when it is unavailable or unusable, or when there is not enough evidence to establish that it meets `Level 1`.",
      "status": "pass",
      "reason": "Baseline website grade",
      "executed": true,
      "checks": []
    },
    {
      "level": 1,
      "description": "To pass `Level 1`, the website must be available, usable, and clearly associated with the government institution. It must load reliably with valid DNS, HTTP, and TLS behavior.",
      "status": "inconclusive",
      "reason": "Insufficient substantive page content: Only 44 visible characters across 4 pages; below substance threshold 200; Insufficient substantive page content: Only 44 visible characters across 4 pages; below substance threshold 200; Insufficient substantive page content: Only 44 visible characters across 4 pages; below substance threshold 200; Insufficient substantive page content: Only 44 visible characters across 4 pages; below substance threshold 200",
      "executed": true,
      "checks": [
        {
          "name": "dns_resolves",
          "level": 1,
          "status": "pass",
          "reason": "Public DNS resolved"
        },
        {
          "name": "domain_not_parked",
          "level": 1,
          "status": "inconclusive",
          "reason": "Insufficient substantive page content: Only 44 visible characters across 4 pages; below substance threshold 200"
        },
        {
          "name": "site_not_defaced",
          "level": 1,
          "status": "inconclusive",
          "reason": "Insufficient substantive page content: Only 44 visible characters across 4 pages; below substance threshold 200"
        },
        {
          "name": "content_relevant",
          "level": 1,
          "status": "inconclusive",
          "reason": "Insufficient substantive page content: Only 44 visible characters across 4 pages; below substance threshold 200"
        },
        {
          "name": "hosting_configured",
          "level": 1,
          "status": "inconclusive",
          "reason": "Insufficient substantive page content: Only 44 visible characters across 4 pages; below substance threshold 200"
        },
        {
          "name": "http_available",
          "level": 1,
          "status": "pass",
          "reason": "HTTP probes did not all fail"
        },
        {
          "name": "redirect_related",
          "level": 1,
          "status": "pass",
          "reason": "No unrelated redirect found"
        },
        {
          "name": "tls_browser_trusted",
          "level": 1,
          "status": "pass",
          "reason": "No browser-blocking TLS error found"
        },
        {
          "name": "tls_not_expired",
          "level": 1,
          "status": "pass",
          "reason": "TLS certificate valid"
        },
        {
          "name": "tls_hostname_matches",
          "level": 1,
          "status": "pass",
          "reason": "TLS certificate valid"
        }
      ]
    },
    {
      "level": 2,
      "description": "To pass `Level 2`, citizens must be able to identify and contact the correct office for the service they need.",
      "status": "inconclusive",
      "reason": "Not run because Level 1 did not pass",
      "executed": false,
      "checks": []
    },
    {
      "level": 3,
      "description": "To pass `Level 3`, citizens must find complete and current instructions, requirements, fees, times, and usable forms.",
      "status": "inconclusive",
      "reason": "Not run because Level 2 did not pass",
      "executed": false,
      "checks": []
    },
    {
      "level": 4,
      "description": "To pass `Level 4`, citizens must be able to complete, pay for, track, and receive the outcome of a service online.",
      "status": "inconclusive",
      "reason": "Not run because Level 3 did not pass",
      "executed": false,
      "checks": []
    },
    {
      "level": 5,
      "description": "To pass `Level 5`, services must be connected across agencies, proactive for eligible citizens, explainable, and accountable.",
      "status": "inconclusive",
      "reason": "Not run because Level 4 did not pass",
      "executed": false,
      "checks": []
    }
  ],
  "vantage": {
    "egress_ip": "172.215.218.17",
    "country": "US",
    "runner": "github-actions",
    "proxy": false
  }
}
