{
  "schema_version": "1.3.0",
  "audit_id": "e3dfcf8a-8828-4452-851a-3cd511fd45f5",
  "url": "http://pgihs.ac.lk/",
  "normalized_url": "http://pgihs.ac.lk/",
  "started_at": "2026-10-20T06:15:04.887728+05:30",
  "completed_at": "2026-10-20T06:15:09.793366+05:30",
  "result": {
    "status": "inconclusive",
    "confidence": 0.5,
    "reasons": [
      "domain_not_parked: Insufficient substantive page content: Only 14 visible characters across 4 pages; below substance threshold 200",
      "site_not_defaced: Insufficient substantive page content: Only 14 visible characters across 4 pages; below substance threshold 200",
      "content_relevant: Insufficient substantive page content: Only 14 visible characters across 4 pages; below substance threshold 200",
      "hosting_configured: Insufficient substantive page content: Only 14 visible characters across 4 pages; below substance threshold 200"
    ]
  },
  "evidence": [
    {
      "check": "dns",
      "status": "pass",
      "detail": "Public DNS resolved",
      "observed_at": "2026-10-20T06:15:05.474724+05:30"
    },
    {
      "check": "domain_registration",
      "status": "error",
      "detail": "Domain is absent from RDAP",
      "observed_at": "2026-10-20T06:15:05.474742+05:30"
    },
    {
      "check": "tls",
      "status": "pass",
      "detail": "TLS certificate valid",
      "observed_at": "2026-10-20T06:15:06.009041+05:30"
    },
    {
      "check": "http",
      "status": "pass",
      "detail": "Probe 1: HTTP 200 at https://pgihs.ac.lk/",
      "source": "https://pgihs.ac.lk/",
      "observed_at": "2026-10-20T06:15:09.791645+05:30"
    },
    {
      "check": "http",
      "status": "pass",
      "detail": "Probe 2: HTTP 200 at http://pgihs.ac.lk/",
      "source": "http://pgihs.ac.lk/",
      "observed_at": "2026-10-20T06:15:09.791668+05:30"
    },
    {
      "check": "http",
      "status": "pass",
      "detail": "Probe 3: HTTP 200 at https://pgihs.ac.lk/",
      "source": "https://pgihs.ac.lk/",
      "observed_at": "2026-10-20T06:15:09.791674+05:30"
    },
    {
      "check": "http",
      "status": "pass",
      "detail": "Probe 4: HTTP 200 at http://pgihs.ac.lk/",
      "source": "http://pgihs.ac.lk/",
      "observed_at": "2026-10-20T06:15:09.791678+05:30"
    },
    {
      "check": "page_text",
      "status": "fail",
      "detail": "Only 14 visible characters across 4 pages; below substance threshold 200",
      "source": "http://pgihs.ac.lk/"
    }
  ],
  "observations": [
    {
      "host": "pgihs.ac.lk",
      "addresses": [
        "124.43.162.194"
      ],
      "status": "resolved",
      "detail": "Public DNS resolved"
    },
    {
      "domain": "ac.lk",
      "status": "unknown",
      "expires_at": null,
      "detail": "Domain is absent from RDAP"
    },
    {
      "host": "pgihs.ac.lk",
      "status": "valid",
      "expires_at": "2026-12-21T04:39:03+05:30",
      "hostname_valid": true,
      "detail": "TLS certificate valid"
    },
    {
      "url": "https://pgihs.ac.lk/",
      "status_code": 200,
      "final_url": "https://pgihs.ac.lk/",
      "redirects": [],
      "elapsed_ms": 974,
      "content_type": "text/html",
      "error": null
    },
    {
      "url": "http://pgihs.ac.lk/",
      "status_code": 200,
      "final_url": "http://pgihs.ac.lk/",
      "redirects": [],
      "elapsed_ms": 495,
      "content_type": "text/html",
      "error": null
    },
    {
      "url": "https://pgihs.ac.lk/",
      "status_code": 200,
      "final_url": "https://pgihs.ac.lk/",
      "redirects": [],
      "elapsed_ms": 732,
      "content_type": "text/html",
      "error": null
    },
    {
      "url": "http://pgihs.ac.lk/",
      "status_code": 200,
      "final_url": "http://pgihs.ac.lk/",
      "redirects": [],
      "elapsed_ms": 490,
      "content_type": "text/html",
      "error": null
    }
  ],
  "snapshots": [
    {
      "url": "https://pgihs.ac.lk/",
      "path": "audit.output/pgihs.ac.lk/20261020.0615/snapshots/page-01-cf83b7aa3e43.html",
      "sha256": "cf83b7aa3e436215dbc9318c12508b444949d52e19f5c8356279a3db33f502ff",
      "bytes": 197
    },
    {
      "url": "http://pgihs.ac.lk/",
      "path": "audit.output/pgihs.ac.lk/20261020.0615/snapshots/page-02-cf83b7aa3e43.html",
      "sha256": "cf83b7aa3e436215dbc9318c12508b444949d52e19f5c8356279a3db33f502ff",
      "bytes": 197
    },
    {
      "url": "https://pgihs.ac.lk/",
      "path": "audit.output/pgihs.ac.lk/20261020.0615/snapshots/page-03-cf83b7aa3e43.html",
      "sha256": "cf83b7aa3e436215dbc9318c12508b444949d52e19f5c8356279a3db33f502ff",
      "bytes": 197
    },
    {
      "url": "http://pgihs.ac.lk/",
      "path": "audit.output/pgihs.ac.lk/20261020.0615/snapshots/page-04-cf83b7aa3e43.html",
      "sha256": "cf83b7aa3e436215dbc9318c12508b444949d52e19f5c8356279a3db33f502ff",
      "bytes": 197
    }
  ],
  "reviewer_decisions": [],
  "levels": [
    {
      "level": 0,
      "description": "A site is classified as `Level 0` when it is unavailable or unusable, or when there is not enough evidence to establish that it meets `Level 1`.",
      "status": "pass",
      "reason": "Baseline website grade",
      "executed": true,
      "checks": []
    },
    {
      "level": 1,
      "description": "To pass `Level 1`, the website must be available, usable, and clearly associated with the government institution. It must load reliably with valid DNS, HTTP, and TLS behavior.",
      "status": "inconclusive",
      "reason": "Insufficient substantive page content: Only 14 visible characters across 4 pages; below substance threshold 200; Insufficient substantive page content: Only 14 visible characters across 4 pages; below substance threshold 200; Insufficient substantive page content: Only 14 visible characters across 4 pages; below substance threshold 200; Insufficient substantive page content: Only 14 visible characters across 4 pages; below substance threshold 200",
      "executed": true,
      "checks": [
        {
          "name": "dns_resolves",
          "level": 1,
          "status": "pass",
          "reason": "Public DNS resolved"
        },
        {
          "name": "domain_not_parked",
          "level": 1,
          "status": "inconclusive",
          "reason": "Insufficient substantive page content: Only 14 visible characters across 4 pages; below substance threshold 200"
        },
        {
          "name": "site_not_defaced",
          "level": 1,
          "status": "inconclusive",
          "reason": "Insufficient substantive page content: Only 14 visible characters across 4 pages; below substance threshold 200"
        },
        {
          "name": "content_relevant",
          "level": 1,
          "status": "inconclusive",
          "reason": "Insufficient substantive page content: Only 14 visible characters across 4 pages; below substance threshold 200"
        },
        {
          "name": "hosting_configured",
          "level": 1,
          "status": "inconclusive",
          "reason": "Insufficient substantive page content: Only 14 visible characters across 4 pages; below substance threshold 200"
        },
        {
          "name": "http_available",
          "level": 1,
          "status": "pass",
          "reason": "HTTP probes did not all fail"
        },
        {
          "name": "redirect_related",
          "level": 1,
          "status": "pass",
          "reason": "No unrelated redirect found"
        },
        {
          "name": "tls_browser_trusted",
          "level": 1,
          "status": "pass",
          "reason": "No browser-blocking TLS error found"
        },
        {
          "name": "tls_not_expired",
          "level": 1,
          "status": "pass",
          "reason": "TLS certificate valid"
        },
        {
          "name": "tls_hostname_matches",
          "level": 1,
          "status": "pass",
          "reason": "TLS certificate valid"
        }
      ]
    },
    {
      "level": 2,
      "description": "To pass `Level 2`, citizens must be able to identify and contact the correct office for the service they need.",
      "status": "inconclusive",
      "reason": "Not run because Level 1 did not pass",
      "executed": false,
      "checks": []
    },
    {
      "level": 3,
      "description": "To pass `Level 3`, citizens must find complete and current instructions, requirements, fees, times, and usable forms.",
      "status": "inconclusive",
      "reason": "Not run because Level 2 did not pass",
      "executed": false,
      "checks": []
    },
    {
      "level": 4,
      "description": "To pass `Level 4`, citizens must be able to complete, pay for, track, and receive the outcome of a service online.",
      "status": "inconclusive",
      "reason": "Not run because Level 3 did not pass",
      "executed": false,
      "checks": []
    },
    {
      "level": 5,
      "description": "To pass `Level 5`, services must be connected across agencies, proactive for eligible citizens, explainable, and accountable.",
      "status": "inconclusive",
      "reason": "Not run because Level 4 did not pass",
      "executed": false,
      "checks": []
    }
  ],
  "vantage": {
    "egress_ip": "20.169.56.52",
    "country": "US",
    "runner": "github-actions",
    "proxy": false
  }
}
