{
  "schema_version": "1.3.0",
  "audit_id": "1f9d7d1a-e1e8-4cf1-ba4d-0fea9686c299",
  "url": "https://mncoe.sch.lk/index.htm",
  "normalized_url": "https://mncoe.sch.lk/index.htm",
  "started_at": "2026-10-13T06:26:58.411789+05:30",
  "completed_at": "2026-10-13T06:27:08.638159+05:30",
  "result": {
    "status": "inconclusive",
    "confidence": 0.5,
    "reasons": [
      "dns_resolves: [Errno -3] Temporary failure in name resolution",
      "domain_not_parked: No usable page was inspected",
      "site_not_defaced: No usable page was inspected",
      "content_relevant: No usable page was inspected",
      "hosting_configured: No usable page was inspected",
      "http_available: HTTP checks did not run",
      "redirect_related: No redirect result was available",
      "tls_browser_trusted: Browser TLS check did not complete",
      "tls_not_expired: TLS expiry check did not run",
      "tls_hostname_matches: TLS hostname check did not run"
    ]
  },
  "evidence": [
    {
      "check": "dns",
      "status": "error",
      "detail": "[Errno -3] Temporary failure in name resolution",
      "observed_at": "2026-10-13T06:27:08.638002+05:30"
    },
    {
      "check": "domain_registration",
      "status": "error",
      "detail": "Domain is absent from RDAP",
      "observed_at": "2026-10-13T06:27:08.638019+05:30"
    }
  ],
  "observations": [
    {
      "host": "mncoe.sch.lk",
      "addresses": [],
      "status": "error",
      "detail": "[Errno -3] Temporary failure in name resolution"
    },
    {
      "domain": "sch.lk",
      "status": "unknown",
      "expires_at": null,
      "detail": "Domain is absent from RDAP"
    }
  ],
  "snapshots": [],
  "reviewer_decisions": [],
  "levels": [
    {
      "level": 0,
      "description": "A site is classified as `Level 0` when it is unavailable or unusable, or when there is not enough evidence to establish that it meets `Level 1`.",
      "status": "pass",
      "reason": "Baseline website grade",
      "executed": true,
      "checks": []
    },
    {
      "level": 1,
      "description": "To pass `Level 1`, the website must be available, usable, and clearly associated with the government institution. It must load reliably with valid DNS, HTTP, and TLS behavior.",
      "status": "inconclusive",
      "reason": "[Errno -3] Temporary failure in name resolution; No usable page was inspected; No usable page was inspected; No usable page was inspected; No usable page was inspected; HTTP checks did not run; No redirect result was available; Browser TLS check did not complete; TLS expiry check did not run; TLS hostname check did not run",
      "executed": true,
      "checks": [
        {
          "name": "dns_resolves",
          "level": 1,
          "status": "inconclusive",
          "reason": "[Errno -3] Temporary failure in name resolution"
        },
        {
          "name": "domain_not_parked",
          "level": 1,
          "status": "inconclusive",
          "reason": "No usable page was inspected"
        },
        {
          "name": "site_not_defaced",
          "level": 1,
          "status": "inconclusive",
          "reason": "No usable page was inspected"
        },
        {
          "name": "content_relevant",
          "level": 1,
          "status": "inconclusive",
          "reason": "No usable page was inspected"
        },
        {
          "name": "hosting_configured",
          "level": 1,
          "status": "inconclusive",
          "reason": "No usable page was inspected"
        },
        {
          "name": "http_available",
          "level": 1,
          "status": "inconclusive",
          "reason": "HTTP checks did not run"
        },
        {
          "name": "redirect_related",
          "level": 1,
          "status": "inconclusive",
          "reason": "No redirect result was available"
        },
        {
          "name": "tls_browser_trusted",
          "level": 1,
          "status": "inconclusive",
          "reason": "Browser TLS check did not complete"
        },
        {
          "name": "tls_not_expired",
          "level": 1,
          "status": "inconclusive",
          "reason": "TLS expiry check did not run"
        },
        {
          "name": "tls_hostname_matches",
          "level": 1,
          "status": "inconclusive",
          "reason": "TLS hostname check did not run"
        }
      ]
    },
    {
      "level": 2,
      "description": "To pass `Level 2`, citizens must be able to identify and contact the correct office for the service they need.",
      "status": "inconclusive",
      "reason": "Not run because Level 1 did not pass",
      "executed": false,
      "checks": []
    },
    {
      "level": 3,
      "description": "To pass `Level 3`, citizens must find complete and current instructions, requirements, fees, times, and usable forms.",
      "status": "inconclusive",
      "reason": "Not run because Level 2 did not pass",
      "executed": false,
      "checks": []
    },
    {
      "level": 4,
      "description": "To pass `Level 4`, citizens must be able to complete, pay for, track, and receive the outcome of a service online.",
      "status": "inconclusive",
      "reason": "Not run because Level 3 did not pass",
      "executed": false,
      "checks": []
    },
    {
      "level": 5,
      "description": "To pass `Level 5`, services must be connected across agencies, proactive for eligible citizens, explainable, and accountable.",
      "status": "inconclusive",
      "reason": "Not run because Level 4 did not pass",
      "executed": false,
      "checks": []
    }
  ],
  "vantage": {
    "egress_ip": "20.118.214.17",
    "country": "US",
    "runner": "github-actions",
    "proxy": false
  }
}
