{
  "schema_version": "1.3.0",
  "audit_id": "7dac43bd-987b-4217-886e-6be6293e6f02",
  "url": "https://nihs.gov.lk",
  "normalized_url": "https://nihs.gov.lk/",
  "started_at": "2026-10-12T06:50:50.867176+05:30",
  "completed_at": "2026-10-12T06:50:57.160029+05:30",
  "result": {
    "status": "fail",
    "confidence": 1.0,
    "reasons": [
      "tls_browser_trusted: Probe 1: [SSL: CERTIFICATE_VERIFY_FAILED] certificate verify failed: Hostname mismatch, certificate is not valid for 'nihs.gov.lk'. (_ssl.c:1010)",
      "tls_hostname_matches: TLS certificate does not match the hostname"
    ]
  },
  "evidence": [
    {
      "check": "dns",
      "status": "pass",
      "detail": "Public DNS resolved",
      "observed_at": "2026-10-12T06:50:51.310429+05:30"
    },
    {
      "check": "domain_registration",
      "status": "error",
      "detail": "Domain is absent from RDAP",
      "observed_at": "2026-10-12T06:50:51.310447+05:30"
    },
    {
      "check": "tls_hostname",
      "status": "fail",
      "detail": "TLS certificate does not match the hostname",
      "observed_at": "2026-10-12T06:50:51.587860+05:30"
    },
    {
      "check": "tls_browser_error",
      "status": "fail",
      "detail": "Probe 1: [SSL: CERTIFICATE_VERIFY_FAILED] certificate verify failed: Hostname mismatch, certificate is not valid for 'nihs.gov.lk'. (_ssl.c:1010)",
      "source": "https://nihs.gov.lk/",
      "observed_at": "2026-10-12T06:50:57.135127+05:30"
    },
    {
      "check": "http",
      "status": "pass",
      "detail": "Probe 2: HTTP 200 at http://nihs.gov.lk/404.html",
      "source": "http://nihs.gov.lk/",
      "observed_at": "2026-10-12T06:50:57.135143+05:30"
    },
    {
      "check": "tls_browser_error",
      "status": "fail",
      "detail": "Probe 3: [SSL: CERTIFICATE_VERIFY_FAILED] certificate verify failed: Hostname mismatch, certificate is not valid for 'nihs.gov.lk'. (_ssl.c:1010)",
      "source": "https://nihs.gov.lk/",
      "observed_at": "2026-10-12T06:50:57.135148+05:30"
    },
    {
      "check": "http",
      "status": "pass",
      "detail": "Probe 4: HTTP 200 at http://nihs.gov.lk/404.html",
      "source": "http://nihs.gov.lk/",
      "observed_at": "2026-10-12T06:50:57.135152+05:30"
    },
    {
      "check": "page_text",
      "status": "pass",
      "detail": "Substantive page content: 5841 visible characters across 2 pages",
      "source": "https://nihs.gov.lk/"
    }
  ],
  "observations": [
    {
      "host": "nihs.gov.lk",
      "addresses": [
        "192.185.12.64"
      ],
      "status": "resolved",
      "detail": "Public DNS resolved"
    },
    {
      "domain": "nihs.gov.lk",
      "status": "unknown",
      "expires_at": null,
      "detail": "Domain is absent from RDAP"
    },
    {
      "host": "nihs.gov.lk",
      "status": "hostname_error",
      "expires_at": "2027-02-06T05:29:59+05:30",
      "hostname_valid": false,
      "detail": "TLS certificate does not match the hostname"
    },
    {
      "url": "https://nihs.gov.lk/",
      "status_code": null,
      "final_url": null,
      "redirects": [],
      "elapsed_ms": null,
      "content_type": null,
      "error": "[SSL: CERTIFICATE_VERIFY_FAILED] certificate verify failed: Hostname mismatch, certificate is not valid for 'nihs.gov.lk'. (_ssl.c:1010)"
    },
    {
      "url": "http://nihs.gov.lk/",
      "status_code": 200,
      "final_url": "http://nihs.gov.lk/404.html",
      "redirects": [
        "http://nihs.gov.lk/404.html"
      ],
      "elapsed_ms": 276,
      "content_type": "text/html",
      "error": null
    },
    {
      "url": "https://nihs.gov.lk/",
      "status_code": null,
      "final_url": null,
      "redirects": [],
      "elapsed_ms": null,
      "content_type": null,
      "error": "[SSL: CERTIFICATE_VERIFY_FAILED] certificate verify failed: Hostname mismatch, certificate is not valid for 'nihs.gov.lk'. (_ssl.c:1010)"
    },
    {
      "url": "http://nihs.gov.lk/",
      "status_code": 200,
      "final_url": "http://nihs.gov.lk/404.html",
      "redirects": [
        "http://nihs.gov.lk/404.html"
      ],
      "elapsed_ms": 271,
      "content_type": "text/html",
      "error": null
    }
  ],
  "snapshots": [
    {
      "url": "http://nihs.gov.lk/404.html",
      "path": "audit.output/nihs.gov.lk/20261012.0650/snapshots/page-01-bccb23d41c2c.html",
      "sha256": "bccb23d41c2cc69cf0c7d22c4314ca8181a513c6999b73e45307792830f4e482",
      "bytes": 11816
    },
    {
      "url": "http://nihs.gov.lk/404.html",
      "path": "audit.output/nihs.gov.lk/20261012.0650/snapshots/page-02-bccb23d41c2c.html",
      "sha256": "bccb23d41c2cc69cf0c7d22c4314ca8181a513c6999b73e45307792830f4e482",
      "bytes": 11816
    }
  ],
  "reviewer_decisions": [],
  "levels": [
    {
      "level": 0,
      "description": "A site is classified as `Level 0` when it is unavailable or unusable, or when there is not enough evidence to establish that it meets `Level 1`.",
      "status": "pass",
      "reason": "Baseline website grade",
      "executed": true,
      "checks": []
    },
    {
      "level": 1,
      "description": "To pass `Level 1`, the website must be available, usable, and clearly associated with the government institution. It must load reliably with valid DNS, HTTP, and TLS behavior.",
      "status": "fail",
      "reason": "Probe 1: [SSL: CERTIFICATE_VERIFY_FAILED] certificate verify failed: Hostname mismatch, certificate is not valid for 'nihs.gov.lk'. (_ssl.c:1010); TLS certificate does not match the hostname",
      "executed": true,
      "checks": [
        {
          "name": "dns_resolves",
          "level": 1,
          "status": "pass",
          "reason": "Public DNS resolved"
        },
        {
          "name": "domain_not_parked",
          "level": 1,
          "status": "pass",
          "reason": "No parked-domain marker found"
        },
        {
          "name": "site_not_defaced",
          "level": 1,
          "status": "pass",
          "reason": "No defacement marker found"
        },
        {
          "name": "content_relevant",
          "level": 1,
          "status": "pass",
          "reason": "No unrelated-content marker found"
        },
        {
          "name": "hosting_configured",
          "level": 1,
          "status": "pass",
          "reason": "No generic-hosting marker found"
        },
        {
          "name": "http_available",
          "level": 1,
          "status": "pass",
          "reason": "HTTP probes did not all fail"
        },
        {
          "name": "redirect_related",
          "level": 1,
          "status": "pass",
          "reason": "No unrelated redirect found"
        },
        {
          "name": "tls_browser_trusted",
          "level": 1,
          "status": "fail",
          "reason": "Probe 1: [SSL: CERTIFICATE_VERIFY_FAILED] certificate verify failed: Hostname mismatch, certificate is not valid for 'nihs.gov.lk'. (_ssl.c:1010)"
        },
        {
          "name": "tls_not_expired",
          "level": 1,
          "status": "inconclusive",
          "reason": "TLS expiry check did not run"
        },
        {
          "name": "tls_hostname_matches",
          "level": 1,
          "status": "fail",
          "reason": "TLS certificate does not match the hostname"
        }
      ]
    },
    {
      "level": 2,
      "description": "To pass `Level 2`, citizens must be able to identify and contact the correct office for the service they need.",
      "status": "inconclusive",
      "reason": "Not run because Level 1 did not pass",
      "executed": false,
      "checks": []
    },
    {
      "level": 3,
      "description": "To pass `Level 3`, citizens must find complete and current instructions, requirements, fees, times, and usable forms.",
      "status": "inconclusive",
      "reason": "Not run because Level 2 did not pass",
      "executed": false,
      "checks": []
    },
    {
      "level": 4,
      "description": "To pass `Level 4`, citizens must be able to complete, pay for, track, and receive the outcome of a service online.",
      "status": "inconclusive",
      "reason": "Not run because Level 3 did not pass",
      "executed": false,
      "checks": []
    },
    {
      "level": 5,
      "description": "To pass `Level 5`, services must be connected across agencies, proactive for eligible citizens, explainable, and accountable.",
      "status": "inconclusive",
      "reason": "Not run because Level 4 did not pass",
      "executed": false,
      "checks": []
    }
  ],
  "vantage": {
    "egress_ip": "20.161.28.177",
    "country": "US",
    "runner": "github-actions",
    "proxy": false
  }
}
